{
  "id": "W2-B3",
  "category": "B",
  "critical": false,
  "status": "active",
  "inputs": {
    "kind": "factory_scenario",
    "scenario_ids": [
      "lab-multipage-003"
    ],
    "note": "MODE: recorded — driven by fixtures/transcriptions/, real claude-opus-5 output recorded against this exact PDF and replayed with no network. Not the ground-truth stub: a case that grades extraction is worthless run against a vision seam that is handed the right answer."
  },
  "expected": "Every analyte row on a multi-page panel is extracted exactly once, and rows on the continuation page are found.",
  "assertions": [
    {
      "rubric": "schema_valid",
      "tier": "det",
      "check": "chk.b_every_row_extracted_once"
    }
  ],
  "guards_against": "Dropped or shifted rows across a page break, and the repeated-entity collapse a VLM produces on a dense table. Both look like a complete report until you count."
}
