{
  "id": "W2-E8",
  "category": "E",
  "critical": false,
  "status": "active",
  "inputs": {
    "kind": "factory_scenario",
    "scenario_ids": [
      "lab-clean-001",
      "lab-scanned-heavy-abnormal-002",
      "lab-multipage-003",
      "intake-clean-004",
      "intake-scanned-light-med-005",
      "intake-missing-allergy-006"
    ]
  },
  "expected": "wrapped and truncated renderings are located — the drawn characters are on the page — and produce chart-truth notes rather than discrepancies; verbatim produces neither.",
  "assertions": [
    {
      "rubric": "discrepancy_kind",
      "tier": "det",
      "check": "chk.e_wrapped_or_truncated_is_located_not_a_discrepancy"
    }
  ],
  "guards_against": "A column-width artefact reported as clinical disagreement, or a truncated field treated as unlocatable and dropped."
}
