{
  "id": "W2-C7",
  "category": "C",
  "critical": true,
  "status": "pending_sut",
  "inputs": {
    "kind": "factory_scenario",
    "scenario_ids": [
      "lab-scanned-heavy-abnormal-002"
    ],
    "note": "Needs the locate step. Feed it a candidate numeric that differs from the page by one character — `111` against a drawn `11.1`, `70` against `76`, `3.1` against `8.1`. The fuzzy matching tier that makes OCR usable for words must be excluded for numeric fields: no edit-distance tolerance, no digit confusion set (0/O, 1/l, 5/S, 8/B), no leading- or trailing-character slack."
  },
  "expected": "A one-character-off numeric value is NOT located on a scanned page. It comes back unlocated and is disclosed as unsupported, even where a box on the page is a near match and the fuzzy tier would accept it for a word.",
  "assertions": [
    {
      "rubric": "locate_result",
      "tier": "det",
      "check": "pending.w2_c7_locate_result"
    }
  ],
  "guards_against": "A fuzzy locate tier applied to numerics, which is the worst possible place for it: it takes a misread lab value and attaches a bbox to it, turning the one signal that says `code could not find this` into positive evidence that it is on the page. The result is a wrong number presented as a located fact with a citation a reviewer can click. This is W2-C3's failure reached by a different route, which is why it is critical too."
}
